{
  "$schema": "https://schema.evideris.com/schemas/qi.schema.json",
  "$id": "https://schema.evideris.com/esge/qi/emr-colon/procedures-per-year.v1.0.0.json",
  "lineageId": "qi-emr-cln-procedures-per-year",
  "type": "qi",
  "version": "1.0.0",
  "release": "r2026.07",
  "supersedes": null,
  "supersededBy": null,
  "language": [
    "en"
  ],
  "withinCurriculum": "cur-emr-colon-2023",
  "title": {
    "en": "Number of procedures performed independently per year (lesions ≥20 mm)"
  },
  "metric": {
    "en": "Number of procedures performed independently per year (lesions ≥20 mm)"
  },
  "unit": "procedures/year",
  "desiredStandard": 70,
  "minimumStandard": null,
  "sourceOrder": 2,
  "originData": {
    "source": "delphi",
    "value": null,
    "confidenceInterval95": null
  },
  "levelOfAgreement": 86,
  "appliesTo": "practitioner",
  "derivedFromRecommendation": "rec-emr-cln-r38-essential-qis",
  "_meta": {
    "provenance": {
      "type": "verbatim",
      "source_doi": "10.1055/a-2077-0497"
    },
    "encodedBy": "human:david",
    "encodedAt": "2026-06-27"
  }
}
