{
  "$schema": "https://schema.evideris.com/schemas/qi.schema.json",
  "$id": "https://schema.evideris.com/esge/qi/esd/surgery-for-complications-rate.v1.0.0.json",
  "lineageId": "qi-esd-surgery-for-complications-rate",
  "type": "qi",
  "version": "1.0.0",
  "release": "r2026.07",
  "supersedes": null,
  "supersededBy": null,
  "language": [
    "en"
  ],
  "withinCurriculum": "cur-esd-2019",
  "title": {
    "en": "Need for surgery because of complications"
  },
  "metric": {
    "en": "with a lower than 1 % need for surgery because of complications"
  },
  "unit": "%",
  "desiredStandard": 1,
  "desiredComparator": "<",
  "sourceOrder": 3,
  "levelOfAgreement": 95,
  "appliesTo": "practitioner",
  "derivedFromRecommendation": "rec-esd-r17-prospective-database-quality-targets-en-bloc-90-perforation",
  "_meta": {
    "provenance": {
      "type": "verbatim",
      "source_doi": "10.1055/a-0996-0912"
    },
    "encodedBy": "human:david",
    "encodedAt": "2026-07-01"
  }
}
