{
  "$schema": "https://schema.evideris.com/schemas/qi.schema.json",
  "$id": "https://schema.evideris.com/esge/qi/esd/en-bloc-resection-rate.v1.0.0.json",
  "lineageId": "qi-esd-en-bloc-resection-rate",
  "type": "qi",
  "version": "1.0.0",
  "release": "r2026.07",
  "supersedes": null,
  "supersededBy": null,
  "language": [
    "en"
  ],
  "withinCurriculum": "cur-esd-2019",
  "title": {
    "en": "En bloc resection rate"
  },
  "metric": {
    "en": "En bloc resection rates should be above 90 %."
  },
  "unit": "%",
  "desiredStandard": 90,
  "levelOfAgreement": 95,
  "appliesTo": "practitioner",
  "derivedFromRecommendation": "rec-esd-r17-prospective-database-quality-targets-en-bloc-90-perforation",
  "_meta": {
    "provenance": {
      "type": "verbatim",
      "source_doi": "10.1055/a-0996-0912"
    },
    "encodedBy": "human:david",
    "encodedAt": "2026-07-01"
  }
}
