{
  "$schema": "https://schema.evideris.com/schemas/qi.schema.json",
  "$id": "https://schema.evideris.com/esge/qi/emr-colon/adenoma-recurrence-with-margin-ablation.v1.0.0.json",
  "lineageId": "qi-emr-cln-adenoma-recurrence-with-margin-ablation",
  "type": "qi",
  "version": "1.0.0",
  "release": "r2026.07",
  "supersedes": null,
  "supersededBy": null,
  "language": [
    "en"
  ],
  "withinCurriculum": "cur-emr-colon-2023",
  "title": {
    "en": "Rate of adenoma recurrence at first surveillance (endoscopically determined), if complete thermal ablation used at index procedure [38]"
  },
  "metric": {
    "en": "Rate of adenoma recurrence at first surveillance (endoscopically determined), if complete thermal ablation used at index procedure [38]"
  },
  "unit": "%",
  "desiredStandard": 1.5,
  "minimumStandard": 2.6,
  "originData": {
    "source": "iace",
    "value": 1.4,
    "confidenceInterval95": {
      "low": 0.8,
      "high": 2.6
    }
  },
  "levelOfAgreement": 89,
  "appliesTo": "practitioner",
  "derivedFromRecommendation": "rec-emr-cln-r38-essential-qis",
  "_meta": {
    "provenance": {
      "type": "verbatim",
      "source_doi": "10.1055/a-2077-0497"
    },
    "encodedBy": "claude:extract-qis@v0.1.0",
    "encodedAt": "2026-06-27"
  },
  "sourceOrder": 15
}
